{
  "query": "How do I add a retriever?",
  "cards": [
    {
      "id": "card-4",
      "type": "procedure",
      "title": "Add a retriever to the fusion stage",
      "steps": [
        {
          "title": "Implement the interface",
          "instruction": {
            "text": "Return ranked candidates from the new source.",
            "mode": "inferred",
            "evidenceIds": [
              "rag/hybrid-retrieval#reciprocal-rank-fusion#1-f18ae3fa"
            ]
          }
        },
        {
          "title": "Register it before fusion",
          "instruction": {
            "text": "Fusion runs before reranking, so register upstream of it.",
            "mode": "extractive",
            "evidenceIds": [
              "rag/hybrid-retrieval#reciprocal-rank-fusion#1-f18ae3fa"
            ]
          }
        }
      ]
    },
    {
      "id": "card-5",
      "type": "evidence",
      "title": "Sources for hybrid retrieval",
      "evidenceIds": [
        "rag/hybrid-retrieval#reciprocal-rank-fusion#0-474a57a9",
        "rag/hybrid-retrieval#reciprocal-rank-fusion#1-f18ae3fa",
        "generative-ui/component-registries#body#0-8b68483e"
      ]
    }
  ],
  "evidence": [
    {
      "id": "rag/hybrid-retrieval#reciprocal-rank-fusion#0-474a57a9",
      "documentId": "rag/hybrid-retrieval",
      "documentTitle": "Hybrid retrieval",
      "section": "Reciprocal rank fusion",
      "text": "Reciprocal rank fusion combines ranked candidate lists without needing comparable scores.",
      "url": "https://example.invalid/notes/rag/hybrid-retrieval",
      "retrievalScore": 0.82,
      "metadata": {
        "category": "rag"
      }
    },
    {
      "id": "rag/hybrid-retrieval#reciprocal-rank-fusion#1-f18ae3fa",
      "documentId": "rag/hybrid-retrieval",
      "documentTitle": "Hybrid retrieval",
      "section": "Reciprocal rank fusion",
      "text": "Fusion is applied before reranking so the reranker sees candidates from both retrievers.",
      "url": "https://example.invalid/notes/rag/hybrid-retrieval",
      "retrievalScore": 0.82,
      "metadata": {
        "category": "rag"
      }
    },
    {
      "id": "generative-ui/component-registries#body#0-8b68483e",
      "documentId": "generative-ui/component-registries",
      "documentTitle": "Component registries",
      "text": "A component registry maps tool results to reviewed components rather than to generated markup.",
      "url": "https://example.invalid/notes/generative-ui/component-registries",
      "retrievalScore": 0.82,
      "metadata": {
        "category": "generative-ui"
      }
    }
  ],
  "suggestedActions": [
    {
      "id": "a1",
      "label": "Show sources",
      "action": "show_sources",
      "payload": {
        "cardId": "card-4"
      }
    },
    {
      "id": "a2",
      "label": "Explain further",
      "action": "explain_further",
      "payload": {
        "cardId": "card-4"
      }
    }
  ],
  "metadata": {
    "knowledgeBaseVersion": "corpus-2026-08-29-a1b2c3d4",
    "generatedAt": "2026-08-29T18:00:00+08:00",
    "incomplete": false
  }
}
